{
  "metadata": {
    "result_schema_version": 1,
    "evaluation_request_id": "7c9e6679-7425-40de-944b-e07fc1f90ae7",
    "package_schema_version": 1,
    "compass_policy_version": "2026.1",
    "rubric_version": "1",
    "gold_standard_version": "patient-a/1",
    "case_version": "patient-a/1",
    "export_schema_version": 1,
    "generated_at": "2026-08-25T14:05:00.000Z",
    "model_label": "example-model",
    "locale": "ja-JP"
  },
  "item_evaluations": [
    {
      "rubric_key": "information_gathering",
      "score": 3,
      "level_label": "概ね到達",
      "rationale": "OT辞退とSST参加、夜間幻聴など、活動と症状に関するInformationが提出内に確認できます。ただし睡眠や参加条件の対比は十分には収集されていないように見えます。",
      "citations": [
        {
          "field_path": "student_submission.form3.informationCards",
          "anonymous_object_id": "card_37bec5170489673d",
          "excerpt": "OTを辞退することがある。SSTには参加できている。",
          "note": "活動に関する観察情報"
        },
        {
          "field_path": "student_submission.form3.informationCards",
          "anonymous_object_id": "card_55aa66bb77cc88dd",
          "excerpt": "夜間に「だめな人間だ」と聞こえることがある。"
        }
      ]
    },
    {
      "rubric_key": "relating_information",
      "score": 2,
      "level_label": "一部到達",
      "rationale": "辞退と参加の両方が記録されていますが、両者の条件差や睡眠との関連づけは提出からは十分には読み取れません。",
      "citations": [
        {
          "field_path": "student_submission.form3.informationCards",
          "anonymous_object_id": "card_37bec5170489673d"
        }
      ],
      "uncertainty_note": "関連づけの意図が振り返りに一部あるが、様式上の明示は限定的"
    },
    {
      "rubric_key": "interpretation_analysis",
      "score": 2,
      "level_label": "一部到達",
      "rationale": "「意欲が低いため活動できない」という解釈が見られます。事実（辞退・参加の混在）との区別や、別の可能性の検討は限られているように見えます。これは不正解という判定ではなく、解釈の幅の確認が必要、という意味です。",
      "citations": [
        {
          "field_path": "student_submission.form3.assessmentCards",
          "anonymous_object_id": "card_aa11bb22cc33dd44",
          "excerpt": "意欲が低いため活動できない可能性がある。"
        }
      ]
    },
    {
      "rubric_key": "clarity_of_evidence",
      "score": 3,
      "level_label": "概ね到達",
      "rationale": "AssessmentにInformationカードへの参照があり、根拠の明示は一部できています。",
      "citations": [
        {
          "field_path": "student_submission.form3.assessmentCards",
          "anonymous_object_id": "card_aa11bb22cc33dd44",
          "note": "evidenceInformationIds に card_37bec5170489673d を参照"
        }
      ]
    },
    {
      "rubric_key": "awareness_of_gaps",
      "score": 3,
      "level_label": "概ね到達",
      "rationale": "振り返りで『参加できている活動との対比は十分でない』と述べており、不足への気づきがあります。一方、睡眠状況など未収集項目の明示は限定的です。",
      "citations": [
        {
          "field_path": "student_submission.field_reflections",
          "anonymous_object_id": "ref_0102030405060708",
          "excerpt": "参加できている活動との対比は十分でない。"
        }
      ]
    },
    {
      "rubric_key": "patient_understanding",
      "score": 2,
      "level_label": "一部到達",
      "rationale": "患者理解は病名と意欲低下に寄っています。提出時点の情報からは、条件によって力が変化する可能性など、別の妥当な理解もあり得ます。Goldと同じ文章である必要はありません。",
      "citations": [
        {
          "field_path": "student_submission.patient_understanding.overview_text",
          "anonymous_object_id": "sub_99aa88bb77cc66dd",
          "excerpt": "統合失調症のため意欲が低く、活動が難しい人だと理解している。"
        }
      ]
    },
    {
      "rubric_key": "overall_integration",
      "score": 3,
      "level_label": "概ね到達",
      "rationale": "様式2・3・振り返り・患者理解は大枠で一貫していますが、解釈と不足情報の扱いが全体として十分に統合されているとは言い切れません。",
      "citations": [
        {
          "field_path": "student_submission.patient_understanding",
          "anonymous_object_id": "sub_99aa88bb77cc66dd"
        },
        {
          "field_path": "student_submission.evidence_links",
          "anonymous_object_id": "lnk_fedcba9876543210"
        }
      ]
    }
  ],
  "student_feedback_draft": {
    "strengths": [
      "OTの辞退とSSTへの参加など、活動に関する観察をInformationとして残せている点が読み取れます。",
      "振り返りで、参加できている活動との対比が十分でないことに自ら触れています。"
    ],
    "supporting_information": [
      "『OTを辞退することがある。SSTには参加できている。』という記録は、活動が一様ではない可能性を考える手がかりになります。",
      "AssessmentからInformationカードへの参照があり、根拠を示そうとする姿勢が確認できます。"
    ],
    "next_questions": [
      "辞退した日と参加できた日で、前夜の睡眠や当日の体調・活動内容に違いはありましたか。",
      "『意欲が低い』以外に、疲労・安心感・活動の種類などで説明できる可能性はあるでしょうか。"
    ],
    "gaps_or_alternatives": [
      "提出からは、OT辞退日前夜の睡眠状況は確認できません。推測で補わず、確認が必要です。",
      "病名と意欲低下だけで理解を固定せず、条件によって力が変化する人、という別の妥当な理解もあり得ます。"
    ],
    "overall_tone_check": "正解／不正解表現なし。代筆なし。非断定。"
  },
  "teacher_observation": {
    "summary": "情報収集は一定ある一方、意欲低下への単一解釈が強く、条件差・不足情報の扱いが評価の焦点になりそうです。AI草案であり確定ではありません。",
    "attention_points": [
      "Assessmentの解釈が事実の両義性（辞退と参加）を十分に反映していない可能性",
      "患者理解が病名起点に寄っている可能性",
      "Gold文章一致は求めないこと"
    ],
    "suggested_focus_for_feedback": "参加／辞退の条件差と、不足情報を次の問いに変える支援"
  },
  "uncertainty": {
    "overall_confidence": "medium",
    "notes": "自由記述が短く、関連づけの意図を過大に読むリスクがあります。欠落情報は補完していません。教員による原文確認を推奨します。",
    "affected_rubric_keys": [
      "relating_information",
      "interpretation_analysis",
      "patient_understanding"
    ]
  },
  "follow_up_checks": [
    {
      "question": "学生は夜間幻聴と日中疲労のつながりを、口頭や別ノートで検討していないか。",
      "reason": "提出スナップショットだけでは、授業内の口頭推論は確認できないため。",
      "related_rubric_keys": ["relating_information", "awareness_of_gaps"]
    },
    {
      "question": "Evidenceリンク以外に、様式2履歴とInformationの対応意図を学生に確認するか。",
      "reason": "リンクは1件のみで、関連づけの全体像が不明瞭なため。",
      "related_rubric_keys": ["clarity_of_evidence", "overall_integration"]
    }
  ],
  "staging_hint": {
    "persist_to": "future_ai_evaluation_staging",
    "must_not_write_to": ["assessment_reviews"],
    "teacher_actions_expected": ["adopt", "edit", "reject"],
    "auto_apply_forbidden": true
  }
}
